{
  "name": "Back to the Future",
  "key": "backtothefuture",
  "verbs": [
    "Reaching 88 mph",
    "Flux capacitating",
    "Time traveling",
    "Accelerating",
    "Recalculating the timeline",
    "Charging the DeLorean",
    "Rewinding",
    "Fast forwarding",
    "Altering the future",
    "Calibrating the time circuits",
    "Dodging paradoxes",
    "Generating gigawatts",
    "Plotting the timeline",
    "Fueling the reactor",
    "Synchronizing clocks"
  ],
  "phrases": [
    "Great Scott",
    "Where we're going we don't need roads",
    "Heavy",
    "Back in time",
    "This is heavy",
    "1.21 gigawatts",
    "Roads Where we're going",
    "Are you telling me you built a time machine",
    "If my calculations are correct",
    "The way I see it",
    "I guess you guys aren't ready for that yet",
    "Nobody calls me chicken",
    "Why don't you make like a tree",
    "Think McFly think",
    "Your future hasn't been written yet",
    "If you put your mind to it",
    "Its your kids Marty",
    "What happens to us in the future",
    "Save the clock tower",
    "That's the power of love"
  ],
  "metadata": {
    "source": "Back to the Future (Film franchise)",
    "contributor": "statusquote-core"
  }
}
