{
  "name": "The Matrix",
  "key": "matrix",
  "verbs": [
    "Jacking in",
    "Dodging bullets",
    "Downloading",
    "Unplugging",
    "Bending reality",
    "Decrypting",
    "Loading the construct",
    "Glitching",
    "Debugging the simulation",
    "Uploading",
    "Tunneling",
    "Recompiling",
    "Tracing",
    "Initializing the Matrix",
    "Freeing minds"
  ],
  "phrases": [
    "There is no spoon",
    "I know kung fu",
    "Follow the white rabbit",
    "Welcome to the real world",
    "He is the One",
    "Free your mind",
    "The Matrix has you",
    "What is real",
    "Take the red pill",
    "Dodge this",
    "Not like this",
    "Mr Anderson",
    "Whoa",
    "Guns lots of guns",
    "I can only show you the door",
    "Everything that has a beginning",
    "Choice is an illusion",
    "What do all men with power want",
    "The answer is out there",
    "Human beings are a disease"
  ],
  "metadata": {
    "source": "The Matrix (Film franchise)",
    "contributor": "statusquote-core"
  }
}
